{"$defs":{"LintIssue":{"additionalProperties":false,"description":"One ``scenarios lint`` finding.","properties":{"message":{"title":"Message","type":"string"},"rule":{"title":"Rule","type":"string"},"scenario_id":{"anyOf":[{"type":"string"},{"type":"null"}],"title":"Scenario Id"}},"required":["scenario_id","rule","message"],"title":"LintIssue","type":"object"}},"$id":"https://agenttruth.dev/schemas/lint-report.v1.json","$schema":"https://json-schema.org/draft/2020-12/schema","additionalProperties":false,"description":"Output of ``agenttruth scenarios lint --json-out``.","properties":{"by_kind":{"additionalProperties":{"type":"integer"},"title":"By Kind","type":"object"},"catalog_sha256":{"pattern":"^[0-9a-f]{64}$","title":"Catalog Sha256","type":"string"},"issues":{"items":{"$ref":"#/$defs/LintIssue"},"title":"Issues","type":"array"},"ok":{"title":"Ok","type":"boolean"},"scenarios":{"title":"Scenarios","type":"integer"},"schema":{"const":"agenttruth.lint-report/v1","title":"Schema","type":"string"},"signatures":{"title":"Signatures","type":"integer"},"truths_sha256":{"anyOf":[{"pattern":"^[0-9a-f]{64}$","type":"string"},{"type":"null"}],"title":"Truths Sha256"}},"required":["schema","catalog_sha256","truths_sha256","ok","scenarios","by_kind","signatures","issues"],"title":"LintReport","type":"object"}
